{
  "schema_version": "GameEngine.RendererCommercialReadinessEvidence.v1",
  "claim_id": "renderer-commercial-readiness-evidence-promotion-v1",
  "source_rows": {
    "d3d12_documentation_source_id": "Microsoft-D3D12-ResourceBarrier-Fence-Timestamp-GpuValidation-2026-06-25",
    "vulkan_documentation_source_id": "Khronos-Vulkan-Synchronization2-Memory-QueueOwnership-2026-06-25",
    "metal_framework_source_id": "Apple-Metal-Framework-Memory-Capture-2026-06-25",
    "metal_shading_language_source_id": "Apple-Metal-Shading-Language-Specification-2026-06-25",
    "unity_legal_source_id": "Unity-Legal-Terms-2026-06-25",
    "unreal_legal_source_id": "Epic-Unreal-Engine-EULA-Trademark-2026-06-25",
    "godot_legal_source_id": "Godot-Trademark-Licensing-2026-06-25",
    "json_schema_source_id": "JSON-Schema-Draft-2020-12-2026-06-25",
    "context7_review_source_id": "Context7-Renderer-Commercial-Readiness-Docs-2026-06-25"
  },
  "backend_rows": {
    "d3d12": {
      "evidence_id": "d3d12",
      "selected": true,
      "ready": true,
      "host_validation_recipe_id": "renderer-d3d12-quality-evidence",
      "retained_artifact_schema_version": "GameEngine.RendererCommercialQualityCloseout.v1",
      "artifact_path": "tests/fixtures/renderer/commercial-readiness-evidence/ready/d3d12-quality.json",
      "artifact_hash_sha256": "a7e27cfe054b86aac92f99b2b6a3827e288b1197f11ac631d7addcdf8df3223b",
      "validation_counter_id": "renderer_d3d12_renderer_quality_ready",
      "diagnostic_code": "ready"
    },
    "vulkan_strict": {
      "evidence_id": "vulkan_strict",
      "selected": true,
      "ready": true,
      "host_validation_recipe_id": "renderer-vulkan-strict-quality-evidence",
      "retained_artifact_schema_version": "GameEngine.RendererCommercialQualityCloseout.v1",
      "artifact_path": "tests/fixtures/renderer/commercial-readiness-evidence/ready/vulkan-strict-quality.json",
      "artifact_hash_sha256": "2489dc60e2923bc952d382bf018e635719b9e358df7c2aabc1eb27d9bc93d755",
      "validation_counter_id": "renderer_vulkan_strict_renderer_quality_ready",
      "diagnostic_code": "ready"
    },
    "apple_metal": {
      "evidence_id": "apple_metal",
      "selected": true,
      "ready": true,
      "host_validation_recipe_id": "renderer-metal-apple-host-evidence",
      "retained_artifact_schema_version": "GameEngine.RendererCommercialQualityCloseout.v1",
      "artifact_path": "tests/fixtures/renderer/commercial-readiness-evidence/ready/apple-metal-host.json",
      "artifact_hash_sha256": "a1907ba4aa3729fa3dff484ccd7aa47612d8521dc96d24b393b0b8ef86df733c",
      "validation_counter_id": "renderer_apple_metal_renderer_quality_ready",
      "diagnostic_code": "ready"
    }
  },
  "package_rows": {
    "visible_3d": {
      "evidence_id": "visible_3d",
      "selected": true,
      "ready": true,
      "host_validation_recipe_id": "desktop-3d-package",
      "retained_artifact_schema_version": "GameEngine.DesktopRuntimePackageEvidence.v1",
      "artifact_path": "tests/fixtures/renderer/commercial-readiness-evidence/ready/visible-3d-package.json",
      "artifact_hash_sha256": "d881e09176831f5af09efcf47927f921c3c7e7a080de016178d2346f7409e727",
      "validation_counter_id": "renderer_visible_3d_package_ready",
      "diagnostic_code": "ready"
    },
    "runtime_ui": {
      "evidence_id": "runtime_ui",
      "selected": true,
      "ready": true,
      "host_validation_recipe_id": "desktop-runtime-ui-package",
      "retained_artifact_schema_version": "GameEngine.DesktopRuntimePackageEvidence.v1",
      "artifact_path": "tests/fixtures/renderer/commercial-readiness-evidence/ready/runtime-ui-package.json",
      "artifact_hash_sha256": "b6c62660f8ac0c90d8edc6e0d1b2405f395e23455a4c02be5ab86a27ecb1f5b6",
      "validation_counter_id": "renderer_runtime_ui_package_ready",
      "diagnostic_code": "ready"
    },
    "environment": {
      "evidence_id": "environment",
      "selected": true,
      "ready": true,
      "host_validation_recipe_id": "environment-package",
      "retained_artifact_schema_version": "GameEngine.EnvironmentPackageEvidence.v1",
      "artifact_path": "tests/fixtures/renderer/commercial-readiness-evidence/ready/environment-package.json",
      "artifact_hash_sha256": "a54a31ba858b2a3f702e37b34751707679979d47011381e31e441403385fbf9b",
      "validation_counter_id": "renderer_environment_package_ready",
      "diagnostic_code": "ready"
    },
    "generated_game": {
      "evidence_id": "generated_game",
      "selected": true,
      "ready": true,
      "host_validation_recipe_id": "generated-game-package",
      "retained_artifact_schema_version": "GameEngine.GeneratedGamePackageEvidence.v1",
      "artifact_path": "tests/fixtures/renderer/commercial-readiness-evidence/ready/generated-game-package.json",
      "artifact_hash_sha256": "958c5916cfe1af58ae59d97580a4a0272ec5e18addd085f54e459df7eb59a38f",
      "validation_counter_id": "renderer_generated_game_package_ready",
      "diagnostic_code": "ready"
    }
  },
  "quality_rows": {
    "renderer_quality_matrix": {
      "evidence_id": "renderer_quality_matrix",
      "selected": true,
      "ready": true,
      "host_validation_recipe_id": "renderer-quality-matrix",
      "retained_artifact_schema_version": "GameEngine.RendererCommercialQualityCloseout.v1",
      "artifact_path": "tests/fixtures/renderer/commercial-readiness-evidence/ready/renderer-quality-matrix.json",
      "artifact_hash_sha256": "b58592d329dee81210302b6d2c50abc6282265f8ee51ad43d02596d2de408963",
      "validation_counter_id": "renderer_quality_matrix_ready",
      "diagnostic_code": "ready"
    },
    "production_vfx_profiling": {
      "evidence_id": "production_vfx_profiling",
      "selected": true,
      "ready": true,
      "host_validation_recipe_id": "renderer-production-vfx-profiling",
      "retained_artifact_schema_version": "GameEngine.RendererCommercialQualityCloseout.v1",
      "artifact_path": "tests/fixtures/renderer/commercial-readiness-evidence/ready/production-vfx-profiling.json",
      "artifact_hash_sha256": "2b184ab8341180fb330291546b78077f25d1a4164246ad0a555f8e1231173e38",
      "validation_counter_id": "renderer_production_vfx_profiling_ready",
      "diagnostic_code": "ready"
    }
  },
  "metal_memory_profiling_rows": {
    "memory_residency": {
      "evidence_id": "memory_residency",
      "selected": true,
      "ready": true,
      "host_validation_recipe_id": "renderer-metal-memory-profiling-host-evidence",
      "retained_artifact_schema_version": "GameEngine.RendererMetalMemoryProfilingHostEvidence.v1",
      "artifact_path": "tests/fixtures/renderer/commercial-readiness-evidence/ready/metal-memory-residency.json",
      "artifact_hash_sha256": "80bf96ba04837548935c443c42d08a0b9d539266ce12b6db9f9e2a7901a86357",
      "validation_counter_id": "renderer_metal_memory_profiling_ready",
      "diagnostic_code": "ready"
    },
    "profiling_capture": {
      "evidence_id": "profiling_capture",
      "selected": true,
      "ready": true,
      "host_validation_recipe_id": "renderer-metal-memory-profiling-host-evidence",
      "retained_artifact_schema_version": "GameEngine.RendererMetalMemoryProfilingHostEvidence.v1",
      "artifact_path": "tests/fixtures/renderer/commercial-readiness-evidence/ready/metal-profiling-capture.json",
      "artifact_hash_sha256": "c5ea830138ed557f87300366e985de7b5dbcd6ee1dae24f072f4d3b1435263ab",
      "validation_counter_id": "renderer_metal_memory_profiling_ready",
      "diagnostic_code": "ready"
    }
  },
  "clean_room_rows": {
    "official_docs_only": {
      "ready": true,
      "public_documentation_only": true,
      "context7_verified": true,
      "official_fallback_documented": true,
      "external_engine_source_review_complete": true
    },
    "legal_review": {
      "ready": true,
      "unity_terms_reviewed": true,
      "unreal_eula_trademark_reviewed": true,
      "godot_trademark_reviewed": true,
      "unity_compatibility": false,
      "unreal_compatibility": false,
      "godot_compatibility": false,
      "compatibility_claims": false,
      "equivalence_claims": false,
      "parity_claims": false
    },
    "third_party_notices": {
      "ready": true,
      "complete": true,
      "notices_path": "THIRD_PARTY_NOTICES.md"
    },
    "forbidden_material_rows": []
  },
  "expected_counters": {
    "renderer_backend_parity_ready": true,
    "renderer_metal_broad_readiness": true,
    "renderer_broad_quality_ready": true,
    "renderer_commercial_readiness": true
  },
  "non_claims": {
    "environment_ready": false,
    "native_handles_exposed": false,
    "cross_backend_inference": false,
    "external_engine_parity": false,
    "external_engine_code_used": false,
    "external_engine_sample_used": false,
    "external_engine_asset_used": false,
    "external_engine_trademark_used": false,
    "external_engine_ui_expression_used": false,
    "unity_compatibility": false,
    "unreal_compatibility": false,
    "godot_compatibility": false
  }
}
